child_name,child_domain,parent_name,parent_domain,verified,evidence,verification_method,date_added
Reward,rewardinsight.com,Experian plc,experianplc.com,Yes,Experian acquired Reward (UK customer engagement company) in 2024 per Wikipedia article.,LLM+web search (optimized),2026-05-15 15:38
Rewatch,rewatch.com,Atlassian Corporation Plc,atlassian.com,Yes,"Atlassian acquired Rewatch on August 29, 2024.",LLM+web search (optimized),2025-08-18 14:46
REWE digital,rewe-digital.com,REWE Group.,rewe-group.com,Yes,"REWE digital is the digital/technology subsidiary of REWE Group, wholly owned by the REWE Group retail conglomerate.",LLM+web search,2026-06-10 07:02
REWE Group,rewe-group.com,REWE-Zentralfinanz eG.,rewe-group.com,Yes,"REWE-Zentralfinanz eG (RZF) is documented as the parent company of the RZF Group, which together with affiliated retailers forms REWE Group.",LLM+web search,2026-05-24 12:03
RGE,rgei.com,Royal Golden Eagle (RGE) Pte Ltd.,rgei.com,Yes,Child and parent share the same domain (heuristic),Heuristic,2026-05-15 15:23
Rheinmetall,rheinmetall.com,Rheinmetall AG,rheinmetall.com,Yes,Child and parent share the same domain (heuristic),Heuristic,2026-05-15 15:24
Rhythm,rhythmagency.com,Stagwell Global Network,stagwellglobal.com,Yes,"Stagwell's own site (stagwellglobal.com/agency/rhythm-agency) lists Rhythm as part of its network, and other sources describe Rhythm as a wholly owned subsidiary within the Stagwell-owned Code and Theory network.",LLM+web search,2026-05-15 16:02
Riachuelo,riachuelo.com.br,Guararapes Confecções S.A.,riachuelo.com.br,Yes,Child and parent share the same domain (heuristic),Heuristic,2026-05-15 15:24
Ribbit Capital-AL,ribbitcap.com,"Ribbit Management Company, LLC.",ribbitcap.com,Yes,Child and parent share the same domain (heuristic),Heuristic,2026-02-06 15:57
Rich Products,rich.com,Rich Products Corporation,richs.com,Yes,Child and parent names match after stripping legal suffix (heuristic),Heuristic,2025-08-04 14:21
Richmond National,richmondnational.com,"Richmond National Group, Inc.",richmondnational.com,Yes,Child and parent share the same domain (heuristic),Heuristic,2026-05-15 15:40
Rich Products Corporation,richs.com,Rich Products Corporation,richs.com,Yes,Child and parent share the same domain (heuristic),Heuristic,2025-08-04 14:21
Dott,ridedott.com,"TIER Mobility SE - Dott's Parent Company, merged as of 2024.",ridedott.com,Yes,Child and parent share the same domain (heuristic),Heuristic,2026-04-15 11:55
RightBound,rightbound.com,"Gong.io, Inc.",gong.io,Yes,Gong.io announced its acquisition of RightBound in December 2025 to add account/contact data into its Revenue AI OS.,LLM+web search,2026-05-15 16:12
RightChoice.ai,rightchoice.ai,Genshi Solutions Private Limited,rightchoice.ai,Yes,"RightChoice.ai's legal registered name is Genshi Solutions Private Limited (same domain rightchoice.ai) — they are the same company, Genshi being the legal entity behind the brand.",LLM+web search,2026-05-18 02:55
Rio Tinto,riotinto.com,Rio Tinto plc and Rio Tinto Limited - dual listed structure.,riotinto.com,Yes,Child and parent share the same domain (heuristic),Heuristic,2026-04-09 20:35
Ripjar,ripjar.com,Long Ridge Equity Partners | Dow Jones & Company,dowjones.com,Yes,Long Ridge Equity Partners completed follow-on majority growth investment in Ripjar in November 2024.,LLM+web search (optimized),2026-05-15 15:45
Rippling,rippling.com,Rippling People Center Inc.,rippling.com,Yes,Child and parent share the same domain (heuristic),Heuristic,2025-07-17 19:58
Risant Health,risanthealth.org,Kaiser Foundation Hospitals,kp.org,Yes,Risant Health was created by and is owned by Kaiser Permanente.,LLM+web search (optimized),2026-04-09 20:41
RISK IDENT,riskident.com,Otto Group,ottogroup.com,Yes,"RISK IDENT is listed as a 100% subsidiary of the Otto Group, spun out from Otto's Liquid Labs in 2012-2013.",LLM+web search,2026-05-15 15:49
RiteCare Utah,ritecareutah.org,Scottish Rite Foundation of Utah,ritecareutah.org,Yes,Child and parent share the same domain (heuristic),Heuristic,2026-02-12 18:49
Rividium Inc,rividium.com,RiVidium Inc.,rividium.com,Yes,Child company Rividium Inc and claimed parent RiVidium Inc appear to be the same company with identical name and different capitalization.,LLM+web search,2026-05-15 15:48
Rizzle,rizzle.com,"SilverLabs Technologies, Inc.",rizzle.com,Yes,"SilverLabs Technologies, Inc. does business as Rizzle (same domain rizzle.com), i.e. they are the same company/entity.",LLM+web search,2026-06-18 13:55
Republic Airways,rjet.com,Republic Airways Holdings Inc.,rjet.com,Yes,"Republic Airways Holdings Inc. is the publicly known parent holding company that owns Republic Airline/Republic Airways (ticker RJET), per Wikipedia and SEC filings.",LLM+web search,2026-07-03 03:13
Raymond James Financial Services Member FINRA/SIPC & A Farah LLC,rjf.com,"Raymond James Financial, Inc.",raymondjames.com,Yes,"Raymond James Financial Services, Inc. is a confirmed FINRA member subsidiary of Raymond James Financial, Inc.",LLM+web search (optimized),2025-09-09 00:52
Shri Ramdeobaba College of Engineering  and Management,rknec.edu,Shri Ramdeobaba Sarvajanik Samiti (SRSS),rknec.edu,Yes,Child and parent share the same domain (heuristic),Heuristic,2026-03-01 08:33
Roadpass Digital,roadpass.com,Graham Allen Partners.,graham-allen.com,Yes,"Graham Allen Partners acquired a controlling majority interest (over 50%) in Roadpass Digital for $81 million in April 2022, making it a parent-owned subsidiary.",LLM+web search,2026-05-15 15:55
Roadpost,roadpost.com,Roadpost Inc.,roadpost.com,Yes,Child and parent share the same domain (heuristic),Heuristic,2026-05-15 15:48
robinhood,robinhood.com,"Robinhood Markets, Inc.",robinhood.com,Yes,Child and parent share the same domain (heuristic),Heuristic,2025-07-23 17:42
Roche,roche.com,Roche Holding AG,roche.com,Yes,Child and parent share the same domain (heuristic),Heuristic,2026-05-15 15:23
Roche Diagnóstica Brasil,roche.com.br,Roche Holding AG,roche.com,Yes,Regional subsidiary of Roche operating in Brazil with local branding,LLM+web search (optimized),2026-05-15 15:39
Rock Ventures,rockcentraldetroit.com,"Rocket Companies, Inc.",rocketcompanies.com,Yes,"rockcentraldetroit.com redirects to rocketcompanies.com, confirming Rocket Companies ownership",LLM+web search (optimized),2025-12-11 10:33
Rocket,rocket.com,"Rocket Companies, Inc.",rocketcompanies.com,Yes,"Rocket is Rocket Mortgage, primary mortgage lending product of Rocket Companies",LLM+web search (optimized),2026-01-30 11:11
Rocket Companies,rocketcompanies.com,Rock Holdings Inc.,rocketcompanies.com,Yes,Child and parent share the same domain (heuristic),Heuristic,2026-02-11 11:01
rocket money,rocketmoney.com,"Rocket Companies, Inc.",rocketcompanies.com,Yes,"Rocket Money is confirmed subsidiary of Rocket Companies, budgeting application",LLM+web search (optimized),2025-07-23 16:46
rocket mortgage,rocketmortgage.com,"Rocket Companies, Inc.",rocketcompanies.com,Yes,"Rocket Mortgage is largest subsidiary of Rocket Companies, primary mortgage lending platform",LLM+web search (optimized),2025-07-23 13:26
Rocketreach,rocketreach.co,Brighton Park Capital,bpc.com,Yes,"Brighton Park Capital acquired majority stake in RocketReach on Aug 10, 2020 for £70 million; RocketReach is confirmed portfolio company.",LLM+web search (optimized),2026-02-10 16:59
Rockfield,rockfieldglobal.co.uk,Rocscience Inc.,rocscience.com,Yes,"Same confirmed acquisition — Rocscience Inc. acquired Rockfield (UK entity), per BusinessWire/Rocscience press release.",LLM+web search,2026-07-06 16:51
Rockfield,rockfieldglobal.com,Rocscience.,rocscience.com,Yes,"Rocscience publicly announced (Aug 2025) its acquisition of Rockfield, per press releases on rocscience.com, rockfieldglobal.com and BusinessWire.",LLM+web search,2026-07-06 16:51
Rockwell Collins,rockwellcollins.com,RTX Corporation (formerly Raytheon Technologies),rtx.com,Yes,UTC acquired Rockwell Collins in 2018; now owned by RTX Corporation through UTC-Raytheon merger (2020).,LLM+web search (optimized),2025-09-17 11:28
ROCKWOOL Group,rockwool.com,ROCKWOOL A/S,rockwool.com,Yes,Child and parent share the same domain (heuristic),Heuristic,2026-05-15 15:25
ROGII,rogii.com,ROGII Inc.,rogii.com,Yes,Child and parent share the same domain (heuristic),Heuristic,2026-05-15 15:39
Rolls-Royce,rolls-royce.com,Rolls-Royce Holdings plc,rolls-royce.com,Yes,Child and parent share the same domain (heuristic),Heuristic,2026-05-15 15:23
RoomeyFinder,roomeyfinder.com,Roomeyfinder Limited,roomeyfinder.com,Yes,Child and parent share the same domain (heuristic),Heuristic,2026-03-23 09:27
"Roper Technologies, Inc.",ropertech.com,"Roper Technologies, Inc.",ropertech.com,Yes,Child and parent share the same domain (heuristic),Heuristic,2026-05-15 15:26
ROSA Experts AG & Co. KG,rosa-ag.de,ROSA AG,rosa-ag.de,Yes,ROSA's own site describes ROSA Experts AG & Co. KG as one of the profit centers within the broader ROSA AG organization.,LLM+web search,2026-05-15 16:08
Rosetta Stone,rosettastone.com,IXL Learning Inc.,ixl.com,Yes,"IXL Learning completed its acquisition of Rosetta Stone in 2021, making it a wholly-owned subsidiary.",LLM+web search,2026-06-15 17:02
Rotageek,rotageek.com,ELMO Software,elmosoftware.com.au,Yes,ELMO Group acquired Rotageek in June 2025 to expand its UK presence in workforce management.,LLM+web search,2026-05-15 15:53
Rover.com,rover.com,Blackstone Group Inc.,blackstone.com,Yes,"Blackstone completed its $2.3 billion all-cash acquisition of Rover.com in February 2024, taking it private.",LLM+web search,2026-06-11 22:49
Rover,rover.io,Blackstone,blackstone.com,Yes,Wikipedia confirms Blackstone acquired Rover.com in February 2024 for $2.3 billion.,LLM+web search (optimized),2026-01-30 14:45
RoX Health,roxhealth.com,Roche Group,roche.com,Yes,RoX Health is described as a digital health innovation studio of the Roche Group / operates as a subsidiary of Roche.,LLM+web search,2026-05-15 16:09
RPG Group,rpggroup.com,RPG Group Ltd.,rpggroup.com,Yes,Child and parent share the same domain (heuristic),Heuristic,2026-05-15 15:23
RR.com,rr.com,"Charter Communications, Inc.",charter.com,Yes,"RR.com (Road Runner) was part of Time Warner Cable, which Charter Communications acquired in 2016, making Charter the controlling parent.",LLM+web search,2026-06-01 04:25
rradar,rradar.com,Rradar (Holdings) Limited,rradar.com,Yes,Child and parent share the same domain (heuristic),Heuristic,2026-03-13 12:01
Robinson Rancheria Resort & Casino,rrrc.com,Robinson Rancheria Band of Pomo Indians.,rrrc.com,Yes,Child and parent share the same domain (heuristic),Heuristic,2025-12-16 13:38
RSM,rsm.global,RSM International Limited,rsm.global,Yes,Child and parent share the same domain (heuristic),Heuristic,2026-05-15 15:23
Raytheon,rtx.com,Raytheon Technologies Corporation,rtx.com,Yes,Child and parent share the same domain (heuristic),Heuristic,2025-08-23 14:49
Run:ai (Acquired by NVIDIA),run.ai,NVIDIA Corporation,nvidia.com,Yes,"NVIDIA's acquisition of Run:ai closed in 2024, as reflected in the child company name itself (""Run:ai (Acquired by NVIDIA)"").",LLM+web search,2026-05-15 16:00
"Running Aces Casino, Hotel & Racetrack",runaces.com,"North Metro Harness Initiative, LLC.",runaces.com,Yes,Child and parent share the same domain (heuristic),Heuristic,2025-08-28 09:44
Runibex,runibex.com,Runibex Technology Group (RTG),runibex.com,Yes,Runibex Technology Group (RTG) is the parent holding company with Runibex Technology Limited as a wholly-owned subsidiary.,LLM+web search,2026-05-15 15:52
Rupa Health,rupahealth.com,"Fullscript Holdings, Inc.",fullscript.com,Yes,"Fullscript Holdings announced its acquisition of Rupa Health in October 2024, confirmed by Fullscript's own blog, Kirkland & Ellis, and Fenwick press releases.",LLM+web search,2026-05-15 16:01
GoodScore,rupicard.com,Arthvit 1809 Tech Pvt. Ltd.,rupicard.com,Yes,"Arthvit 1809 Tech is parent company of GoodScore; founders own 67.6%, venture investors own remainder—clear majority ownership.",LLM+web search,2026-05-15 15:47
Freelance/Self Employed,ruralmutual.com,"Rural Mutual Insurance Group, LLC.",ruralmutual.com,Yes,Child and parent share the same domain (heuristic),Heuristic,2026-02-23 13:01
RVU,rvu.co.uk,Red Ventures,redventures.com,Yes,"Red Ventures website confirms RVU was created through Red Ventures' joint-acquisition of ZPG Group in 2018, demonstrating control/majority ownership.",LLM+web search (optimized),2026-05-15 15:30
Rws Group,rws.com,RWS Holdings plc,rws.com,Yes,Child and parent share the same domain (heuristic),Heuristic,2026-02-16 12:23
Ryanair - Europe's Favourite Airline,ryanair.com,Ryanair Holdings plc,ryanair.com,Yes,Child and parent share the same domain (heuristic),Heuristic,2026-05-15 15:23
RZForex,rzforex.com,Ruizean Pty Ltd ACN 167 543 580,rzforex.com,Yes,"The claimed parent Ruizean Pty Ltd shares the exact same domain (rzforex.com) as RZForex, indicating it is simply the registered legal entity operating the RZForex brand.",LLM+web search,2026-05-15 16:15
S-ryhmä / S Group,s-ryhma.fi,SOK Corporation,s-ryhma.fi,Yes,Child and parent share the same domain (heuristic),Heuristic,2026-05-15 15:24
Coda,s3m.us,"Grammarly, Inc.",grammarly.com,Yes,Coda acquired by Grammarly in December 2024; became subsidiary.,LLM+web search (optimized),2026-02-17 13:29
Safe Software,safe.com,"JMI Equity Partners, LLC",jmi.com,Yes,JMI Equity made strategic growth investment in Safe Software; confirmed as portfolio company.,LLM+web search (optimized),2026-05-15 15:36
SafePoint Insurance Company,safepointins.com,"SafePoint Holdings, Inc.",safepointins.com,Yes,Child and parent share the same domain (heuristic),Heuristic,2026-05-15 15:39
Safeway,safeway.com,"Albertsons Companies, Inc.",albertsonscompanies.com,Yes,"Albertsons acquired Safeway Inc. in January 2015 for $9.2 billion, providing clear majority ownership.",LLM+web search (optimized),2026-01-20 13:50
SAF Platform,safplatform.com,"Strategic Alternative Funds Group, LLC",safplatform.com,Yes,Child and parent share the same domain (heuristic),Heuristic,2025-08-18 08:41
SAGA Diagnostics,sagadiagnostics.com,Roche Holding AG.,roche.com,Yes,Roche (through Foundation Medicine subsidiary) acquired SAGA Diagnostics for $595M in 2026.,LLM+web search,2026-05-15 15:46
Sage Home Loans Corporation,sagehomeloans.com,"Red Ventures, LLC.",redventures.com,Yes,Red Ventures website explicitly lists Sage Home Loans Corporation as one of its seven owned U.S. businesses.,LLM+web search (optimized),2026-05-15 15:41
Saint-Gobain,saint-gobain.com,Compagnie de Saint-Gobain S.A.,saint-gobain.com,Yes,Child and parent share the same domain (heuristic),Heuristic,2026-05-15 15:23
Saint Peter's Healthcare System,saintpetershcs.com,Saint Peter’s Healthcare System Inc.,saintpetershcs.com,Yes,Child and parent share the same domain (heuristic),Heuristic,2025-09-18 10:22
"SALT Lending Holdings, Inc.",saltlending.com,Salt Blockchain Inc.,saltlending.com,Yes,Child and parent share the same domain (heuristic),Heuristic,2025-08-12 11:42
Salt'n Pepper,saltnpepper.com.pk,Foodconsults (Pvt.) Limited,saltnpepper.com.pk,Yes,Child and parent share the same domain (heuristic),Heuristic,2026-03-23 09:28
Sam's Club,samsclub.com,Walmart Inc.,walmart.com,Yes,"Sam's Club is a wholly-owned subsidiary of Walmart Inc., a well-established public fact.",LLM+web search,2026-06-18 20:39
Samsung Semiconductor Us,samsung.com,"Samsung Group, through Samsung C&T Corporation as its de facto holding company.",samsung.com,Yes,Child and parent share the same domain (heuristic),Heuristic,2025-07-18 20:09
Samsung Ads,samsungads.com,"Samsung Electronics Co., Ltd.",samsung.com,Yes,Samsung Ads is clearly a Samsung Electronics subsidiary/brand division.,LLM+web search (optimized),2026-03-13 12:00
Sandals Resorts International,sandals.com,Sandals Resorts International (SRI),sandals.com,Yes,Child and parent share the same domain (heuristic),Heuristic,2026-05-15 15:26
Sandbox,sandbox.ing,ING Group N.V.,ing.com,Yes,Sandbox.ing is an ING Group subsidiary based on domain structure and company operations.,LLM+web search (optimized),2025-07-23 14:10
Sandbox Wealth,sandboxwealth.com,The Sandbox Companies Inc.,sandboxwealth.com,Yes,"Sandbox Wealth operates under the legal parent entity 'The Sandbox Companies Inc.' (same domain sandboxwealth.com per ZoomInfo), i.e. it is the corporate/legal parent of the brand.",LLM+web search,2026-05-18 12:04
Sanderson Farms,sandersonfarms.com,Cargill and Continental Grain Co.,cargill.com,Yes,Cargill and Continental Grain completed acquisition of Sanderson Farms for $4.53 billion in July 2022.,LLM+web search (optimized),2026-01-25 13:42
Sangoma,sangoma.com,Sangoma.com Inc.,sangoma.com,Yes,Child and parent share the same domain (heuristic),Heuristic,2026-01-19 11:38
Sankaty Wealth Management | Northwestern Mutual Private Client Group,sankatygroup.com,Bain Capital,baincapital.com,Yes,"Sankaty Advisors is the credit affiliate of Bain Capital, later rebranded as Bain Capital Credit.",LLM+web search (optimized),2025-10-14 09:09
Sanofi,sanofi.com,Sanofi S.A.,sanofi.com,Yes,Child and parent share the same domain (heuristic),Heuristic,2026-04-09 20:38
Santander UK,santander.co.uk,"Banco Santander, S.A.",santander.com,Yes,"Santander UK is a subsidiary of Banco Santander, S.A.",LLM+web search (optimized),2025-10-07 12:53
Santander,santander.com,"Banco Santander, S.A.",santander.com,Yes,Child and parent share the same domain (heuristic),Heuristic,2026-02-08 11:23
SAP Fioneer,sapfioneer.com,SAP SE and Dediq GmbH (joint venture),sapfioneer.com,Yes,Child and parent share the same domain (heuristic),Heuristic,2026-04-22 12:06
Sapphire Software Solutions,sapphiresolutions.net,NTT DATA Business Solutions AG,nttdata.com,Yes,Wikipedia confirms NTT DATA Business Solutions merged with Sapphire Systems in 2024.,LLM+web search (optimized),2026-05-15 15:36
Sartorius,sartorius.com,Sartorius AG,sartorius.com,Yes,Sartorius AG is confirmed as the parent holding company of the Sartorius Group (e.g. holds ~71.5% of Sartorius Stedim Biotech and 100% of Sartorius Lab Holding GmbH).,LLM+web search,2026-07-07 23:04
,satx.rr.com,"Charter Communications, Inc.",corporate.charter.com,Yes,"satx.rr.com is a legacy Time Warner Cable/Road Runner email domain, and Charter Communications acquired Time Warner Cable in 2016, making it the controlling parent.",LLM+web search,2026-06-17 15:47
Sava,sava.health,Infoshare+,infoshareplus.com,Yes,"Sava Technology was acquired by Infoshare+ (backed by Omni Partners) on July 3, 2025, making it a wholly-owned subsidiary.",LLM+web search,2026-05-15 15:49
Savvy Wealth,savvywealth.com,Savvy Wealth Inc.,savvywealth.com,Yes,Child and parent share the same domain (heuristic),Heuristic,2025-07-16 11:52
Sbarro,sbarro.com,"Sbarro Holdings, LLC",sbarro.com,Yes,Child and parent share the same domain (heuristic),Heuristic,2025-10-13 09:06
SBペイメントサービス(株),sbpayment.co.jp,SoftBank Corp.,softbank.jp,Yes,SB Payment Service Corp. (SBペイメントサービス) was established as a 100% subsidiary of SoftBank and remains part of the SoftBank Group corporate structure.,LLM+web search,2026-05-15 16:14
Standard Chartered,sc.com,Standard Chartered PLC,sc.com,Yes,Child and parent share the same domain (heuristic),Heuristic,2026-05-15 15:23
The Scale Factory,scalefactory.com,Ten10 Solutions Ltd.,ten10.com,Yes,"Multiple outlets (Consultancy.uk, GlobeNewswire, Crunchbase) confirm Ten10 Solutions acquired The Scale Factory in Nov 2024.",LLM+web search,2026-05-15 15:59
scalyst GmbH,scalyst.com,scalyst AG,scalyst.com,Yes,"scalyst AG operates as an umbrella/holding company over related scalyst entities (e.g., scalyst Ventures GmbH, scalyst Brands GmbH), consistent with scalyst AG being the controlling parent of scalyst GmbH.",LLM+web search,2026-05-15 16:18
"The Scan Group, Inc.",scangroup.net,SCAN Group Inc.,scangroup.net,Yes,Child and parent share the same domain (heuristic),Heuristic,2026-05-15 15:28
SCASSI - Expert cybersécurité des systèmes critiques & embarqués,scassi.com,Squad (Cybersecurity),squadgroup.com,Yes,Squad acquired SCASSI in May 2024; SCASSI became a subsidiary of the SQUAD Group.,LLM+web search,2026-05-15 15:53
SCE,sce.com,Edison International,edison.com,Yes,Wikipedia confirms SCE is 'largest subsidiary of Edison International' which is parent company.,LLM+web search (optimized),2025-09-16 07:26
Schaeffler,schaeffler.com,INA Holding Schaeffler GmbH & Co. KG.,schaeffler.com,Yes,Child and parent share the same domain (heuristic),Heuristic,2026-05-15 15:23
Schema App,schemaapp.com,Hunch Manifest Inc.,schemaapp.com,Yes,"Schema App is a product operated under Hunch Manifest Inc, which is the parent company.",LLM+web search,2026-05-15 15:54
Schiphol Real Estate,schiphol.nl,Royal Schiphol Group N.V.,schiphol.nl,Yes,Child and parent share the same domain (heuristic),Heuristic,2026-05-15 15:26
Schneps Media,schnepsmedia.com,"Schneps Communications, Inc.",schnepsmedia.com,Yes,"Schneps Media's own site and Wikipedia state that Schneps Communications was rebranded as Schneps Media, i.e. the same family-owned company under a prior legal name.",LLM+web search,2026-06-10 09:04
School Journey,schooljourney.com,School Journey Inc.,schooljourney.com,Yes,Child and parent share the same domain (heuristic),Heuristic,2025-04-04 19:54
Schörling,schorlingab.se,"Melker Schörling AB (MSAB) and controlling interests in various companies, such as Absolent Group which has 55.7% of capital and votes.",schorlingab.se,Yes,Child and parent share the same domain (heuristic),Heuristic,2026-05-15 15:22
Schub,schub.cloud,"TTS Ops, LLC dba Schub",schub.cloud,Yes,"Public business listings show 'TTS Ops, LLC dba Schub,' confirming TTS Ops LLC is the legal entity doing business as Schub (same company, same domain).",LLM+web search,2026-05-15 16:05
Elsevier | SciBite,scibite.com,"Elsevier, part of RELX Group plc.",elsevier.com,Yes,Elsevier (part of RELX) acquired SciBite (scibite.com) in August 2020.,LLM+web search,2026-06-11 12:07
Scope Ratings,scopegroup.com,Scope SE & Co. KGaA,scopegroup.com,Yes,Child and parent share the same domain (heuristic),Heuristic,2026-05-15 15:37
Scotiabank,scotiabank.com,The Bank of Nova Scotia (Scotiabank) - operates as a controlling entity.,scotiabank.com,Yes,Child and parent share the same domain (heuristic),Heuristic,2026-05-15 15:22
Scotiabank Colpatria,scotiabankcolpatria.com,Bank of Nova Scotia (Scotiabank) S.A.,scotiabank.com,Yes,"Bank of Nova Scotia acquired 51% of Banco Colpatria, making it a majority-owned subsidiary.",LLM+web search (optimized),2026-01-21 00:24
Scribeless,scribeless.co,The Overnight Insights Group Ltd.,scribeless.co,Yes,Child and parent share the same domain (heuristic),Heuristic,2025-03-08 05:48
"UP, Inc",scrollhappy.com,"WE3 Group, Inc.",scrollhappy.com,Yes,Child and parent share the same domain (heuristic),Heuristic,2026-03-23 09:25
Shelby County Schools,scsk12.org,Shelby County Board of Education,scsk12.org,Yes,Child and parent share the same domain (heuristic),Heuristic,2025-09-17 21:01
SculptSoft,sculptsoft.com,SculptSoft Private Limited,sculptsoft.com,Yes,Child and parent share the same domain (heuristic),Heuristic,2026-03-23 09:30
SDK Tek Services Ltd,sdktek.com,Ateko.,ateko.com,Yes,Ateko (backed by Bell Canada) acquired SDK Tek Services Ltd in December 2025 and now operates it as a subsidiary.,LLM+web search,2026-05-15 15:48
KAISER PERMANENTE SANTA CLARA MEDICAL CENTER,seagate.com,Seagate Technology Holdings plc,seagate.com,Yes,Child and parent share the same domain (heuristic),Heuristic,2026-01-19 14:54
"Sealing Technologies, a Parsons Company",sealingtech.com,Parsons Corporation,parsons.com,Yes,Sealing Technologies acquired by Parsons Corporation in August 2023.,LLM+web search (optimized),2026-05-15 15:45
loom,seanlingren.com,Atlassian Corporation Plc.,atlassian.com,Yes,Atlassian acquired Loom in October 2023 for $975M.,LLM+web search (optimized),2026-03-23 09:28
Seattle Mortgage,seattlesmortgagebroker.com,"City Mortgage Brokers, LLC.",seattlesmortgagebroker.com,Yes,Child and parent share the same domain (heuristic),Heuristic,2025-09-29 15:04
Secure-IC,secure-ic.com,"Cadence Design Systems, Inc.",cadence.com,Yes,Secure-IC website states 'Secure-IC is now part of Cadence' confirming majority ownership.,LLM+web search (optimized),2026-05-15 15:44
Securian Financial,securian.com,"Securian Financial Group, Inc.",securian.com,Yes,Child and parent share the same domain (heuristic),Heuristic,2026-01-22 11:13
SAM Seamless Network,securingsam.com,Qualcomm,qualcomm.com,Yes,Qualcomm acquired SAM Seamless Network in 2026 for over $150 million; SAM now operates as a Qualcomm subsidiary.,LLM+web search,2026-05-15 15:54
Securly,securly.com,Golden Gate Capital,goldengatecap.com,Yes,"Golden Gate Capital acquired Securly, an ed-tech security company, in March 2021.",LLM+web search (optimized),2026-05-15 15:36
シードテック株式会社,seedtech.co.jp,Geechs Inc.,geechs.com,Yes,"Geechs Inc. established Seed Tech Inc. as a new group company, spinning off its offshore-development/programming-school business into it.",LLM+web search,2026-05-15 16:05
seekme.io,seekme.io,seekme AG,seekme.io,Yes,Child and parent share the same domain (heuristic),Heuristic,2026-04-28 10:52
SEEN Group,seengroup.com,Beauty SEEN Ltd.,seengroup.com,Yes,Child and parent share the same domain (heuristic),Heuristic,2026-03-14 05:44
Select Medical,selectmedical.com,Select Medical Corporation,selectmedical.com,Yes,Child and parent share the same domain (heuristic),Heuristic,2026-05-15 15:23
Oracle,selectminds.com,Oracle Corporation,oracle.com,Yes,Child and parent names match after stripping legal suffix (heuristic),Heuristic,2025-07-18 17:14
