child_name,child_domain,parent_name,parent_domain,verified,evidence,verification_method,date_added
LINE,linecorp.com,LY Corporation,lycorp.co.jp,Yes,LINE Corporation is major subsidiary of LY Corporation (formed through Z Holdings merger October 2023).,LLM+web search (optimized),2026-05-15 15:30
Lineman.io,lineman.io,Goo Holdings Ltd.,lineman.io,Yes,"Goo Holdings Ltd. trades as 'Lineman' and operates the lineman.io product directly, per company search results.",LLM+web search,2026-07-06 14:12
Linewize US (part of the Qoria family),linewize.com,Qoria,qoria.com,Yes,"Linewize was acquired by Family Zone in 2017, which rebranded to Qoria in 2023; Qoria is the majority owner.",LLM+web search,2026-05-15 15:49
Linxup,linxup.com,Spectrum Equity,spectrumequity.com,Yes,Linxup is a Spectrum Equity portfolio company.,LLM+web search (optimized),2026-05-15 15:42
Liquid Death,liquiddeath.com,"Supplying Demand, Inc.",liquiddeath.com,Yes,Child and parent share the same domain (heuristic),Heuristic,2025-07-16 12:28
LIQUIDITY,liquidity.com,Liquidity Group US Investments LP,liquidity.com,Yes,Child and parent share the same domain (heuristic),Heuristic,2026-05-15 15:41
Liquid Reply,liquidreply.com,Reply Group S.p.A.,reply.com,Yes,Liquid Reply is explicitly described as 'a Reply Group Company' operating as a subsidiary within the Reply S.p.A. group structure.,LLM+web search,2026-05-15 15:57
,lirr.org,Metropolitan Transportation Authority (MTA),mta.info,Yes,"Domain lirr.org confirms Long Island Rail Road, which is an MTA subsidiary operating New York commuter rail.",LLM+web search (optimized),2026-01-29 22:19
LiteBit,litebit.eu,Bitvavo B.V.,bitvavo.com,Yes,"LiteBit.eu redirects to Bitvavo's official page about LiteBit, indicating Bitvavo B.V. owns/operates LiteBit.",LLM+web search (optimized),2026-04-09 20:45
sr. loan specialist,liveoak.bank,"Live Oak Bancshares, Inc.",liveoak.bank,Yes,Child and parent share the same domain (heuristic),Heuristic,2025-07-17 10:55
Liveramp,liveramp.com,Publicis Groupe SA.,publicisgroupe.com,Yes,LiveRamp was acquired by Publicis for $2.2 billion in May 2026.,LLM+web search (optimized),2025-08-01 14:05
Livi France,livi.fr,Kry International AB (publ),kry.se,Yes,"Livi is Kry International AB's brand name used in France and other non-Nordic markets, not a separately owned company.",LLM+web search,2026-05-29 09:01
LIXIL,lixil.com,Lixil Group Corporation,lixil.com,Yes,Child and parent share the same domain (heuristic),Heuristic,2026-05-15 15:26
LTI - Larsen & Toubro Infotech,lntinfotech.com,Larsen & Toubro Limited (L&T),larsentoubro.com,Yes,LTI-Larsen & Toubro Infotech (now LTIMindtree) is owned by Larsen & Toubro; clear subsidiary.,LLM+web search (optimized),2026-05-06 01:04
Loadsure,loadsure.net,Loadsure LTD,loadsure.net,Yes,Loadsure is the same company as claimed parent Loadsure LTD.,LLM+web search,2026-05-15 15:56
Localyze,localyze.com,Boundless Immigration Inc.,boundless.com,Yes,"Boundless Immigration announced its acquisition of Localyze on October 1, 2025, per Boundless's own press release and multiple news outlets.",LLM+web search,2026-05-15 15:57
Locker in the City | Smart Lockers for Urban Travelers,lockerinthecity.com,"WANDERLUST CORNER, S.L.",lockerinthecity.com,Yes,Locker in the City's legal entity name is Wanderlust Corner SL.,LLM+web search,2026-05-15 15:56
Locus,locus.sh,Ingka Group (IKEA),ingka.com,Yes,Ingka Group (IKEA's largest retailer) acquired Locus in 2025 (confirmed on Locus website).,LLM+web search (optimized),2026-05-15 15:39
Lodestone Real Estate Powered by eXp,lodestonerealestate.com,eXp Realty LLC,exprealty.com,Yes,Lodestone Real Estate website footer displays copyright '© eXp Realty LLC All Rights Reserved'.,LLM+web search (optimized),2026-01-26 21:34
Loft Federal,loftfederal.com,"Loft Orbital Federal, LLC.",loftfederal.com,Yes,"Loft Federal is a wholly-owned subsidiary formed by Loft Orbital for US government/defense work (SpaceNews, ExecutiveBiz); parent record shares the same domain confirming the corporate family link.",LLM+web search,2026-07-10 15:19
Lofty,lofty.com,"Moatable, Inc.",moatable.com,Yes,"Lofty Inc confirmed as subsidiary of Moatable, Inc.; launched by Moatable in August 2016.",LLM+web search,2026-05-15 15:47
Logflare,logflare.app,Supabase,supabase.com,Yes,"Supabase acquired Logflare in 2021, and it now operates as part of Supabase's logging infrastructure.",LLM+web search,2026-06-24 10:42
Logicloop,logicloopdigital.com,Logicloop Ventures Ltd.,logicloopdigital.com,Yes,Child and parent share the same domain (heuristic),Heuristic,2026-05-15 15:38
Logient x Wepoint,logient.com,Onepoint Group Inc.,groupeonepoint.com,Yes,Onepoint Group acquired Logient through Wepoint Canada subsidiaries in September 2025,LLM+web search (optimized),2026-05-15 15:46
Logifuture,logifuture.com,Logifuture Holding Ltd.,logifuture.com,Yes,Child and parent share the same domain (heuristic),Heuristic,2026-05-15 15:38
Logikfabriken,logikfabriken.se,Logikfabriken Holding AB,logikfabriken.se,Yes,Logikfabriken Holding AB (logikfabriken.se) is confirmed as the holding company owning Logikfabriken AB and other subsidiaries in the same group.,LLM+web search,2026-05-15 16:04
Logitech,logitech.com,Logitech International S.A.,logitech.com,Yes,Child and parent share the same domain (heuristic),Heuristic,2025-07-18 16:17
LOGO.com | Free Logo Maker,logo.com,Verus Software Inc.,logo.com,Yes,"LOGO.com is confirmed to be operated by Verus Software Inc., sharing the same domain (logo.com), indicating Verus Software is the owning entity.",LLM+web search,2026-05-15 16:07
Lookiero,lookiero.com,Lookiero Outfittery Group.,lookiero.com,Yes,Child and parent share the same domain (heuristic),Heuristic,2026-05-15 15:38
Loop,loophealth.com,Invoq Healthcare India Pvt Ltd.,loophealth.com,Yes,Child and parent share the same domain (heuristic),Heuristic,2026-01-02 02:23
foehr property management,loopnet.com,"CoStar Group, Inc.",costargroup.com,Yes,LoopNet is a confirmed subsidiary of CoStar Group; foehr property management domain resolves to LoopNet.,LLM+web search (optimized),2025-07-23 11:51
Lopay,lopay.com,Lopay Corp.,lopay.com,Yes,Child and parent share the same domain (heuristic),Heuristic,2026-05-06 06:38
Louis Vuitton,louisvuitton.com,LVMH Moët Hennessy Louis Vuitton SE,lvmh.com,Yes,Louis Vuitton is the founder brand and core subsidiary of LVMH.,LLM+web search (optimized),2025-09-19 11:09
Love's Travel Stops,loves.com,Love's Family of Companies,loves.com,Yes,Child and parent share the same domain (heuristic),Heuristic,2026-05-15 15:25
Lowell Five Bank,lowellfive.com,"Lowell Five Bancorp, MHC.",lowellfive.com,Yes,Child and parent share the same domain (heuristic),Heuristic,2025-08-29 12:09
Lowes Super Market,lowesmarket.com,"Pay and Save, Inc.",lowesmarket.com,Yes,Child and parent share the same domain (heuristic),Heuristic,2026-02-02 15:34
Team Loxo,loxo.co,Eli Lilly and Company,lilly.com,Yes,Eli Lilly acquired Loxo Oncology in 2019 for $8 billion (Team Loxo same entity).,LLM+web search (optimized),2025-02-24 15:20
Loyaltek Group,loyaltek.com,Loyaltek Group,loyaltek.com,Yes,Child and parent share the same domain (heuristic),Heuristic,2026-05-15 15:43
Mickley Wealth Strategies of LPL Financial,lpl.com,LPL Financial Holdings Inc.,lpl.com,Yes,Child and parent share the same domain (heuristic),Heuristic,2025-07-14 17:10
London Stock Exchange Group,lseg.com,London Stock Exchange Group plc (LSEG),lseg.com,Yes,Child and parent share the same domain (heuristic),Heuristic,2025-09-18 13:05
LTIMindtree,ltimindtree.com,Larsen & Toubro,larsentoubro.com,Yes,Larsen & Toubro holds 68.57% ownership of LTIMindtree; established majority control.,LLM+web search (optimized),2026-05-04 11:23
LTM,ltm.com,Larsen & Toubro Limited,larsentoubro.com,Yes,LTM Limited (formerly LTIMindtree) is subsidiary of Larsen & Toubro; name changed to LTM in March 2026.,LLM+web search (optimized),2026-04-09 20:36
L&T Technology Services Limited,ltts.com,Larsen & Toubro Limited,larsentoubro.com,Yes,L&T Technology Services Limited is subsidiary of Larsen & Toubro Limited; established subsidiary.,LLM+web search (optimized),2026-03-13 11:58
The Lubrizol Corporation,lubrizol.com,"Berkshire Hathaway, Inc.",berkshirehathaway.com,Yes,Wikipedia confirms Lubrizol has been a Berkshire Hathaway subsidiary since 2011 acquisition for $9.7 billion.,LLM+web search (optimized),2025-08-04 15:36
Lucents Technology,lucentshq.com,Nokia Corporation,nokia.com,Yes,"Nokia acquired Alcatel-Lucent in 2016, which had previously acquired Lucent Technologies; Lucent became part of Nokia's subsidiary structure.",LLM+web search (optimized),2026-04-04 00:49
Lucid Motors,lucidmotors.com,Public Investment Fund of Saudi Arabia,pif.gov.sa,Yes,Lucid Motors is majority-owned by PIF with ~57% equity stake through Ayar Third Investment Company since April 2019.,LLM+web search (optimized),2025-08-26 16:00
Lucira Jewelry,lucirajewelry.com,DIVINECARAT LIFESTYLES PRIVATE LIMITED,lucirajewelry.com,Yes,"Lucira Jewelry's website (lucirajewelry.com) is operated/managed by Divinecarat Lifestyles Private Limited, its Mumbai-based operating entity.",LLM+web search,2026-05-15 16:08
Lufthansa Industry Solutions,lufthansa-industry-solutions.com,Lufthansa Group,lufthansagroup.com,Yes,"Lufthansa Industry Solutions is a subsidiary of Lufthansa Group, formed in 2015 from restructuring of Lufthansa Systems AG.",LLM+web search (optimized),2026-04-09 20:39
Luizalabs,luizalabs.com,Magazine Luiza S.A.,magazineluiza.com.br,Yes,Luizalabs is technology and innovation division of Magazine Luiza S.A.,LLM+web search (optimized),2026-03-13 12:02
Lulus,lulus.com,"Lulu's Fashion Lounge Holdings, Inc.",lulus.com,Yes,Child and parent share the same domain (heuristic),Heuristic,2025-12-16 13:24
Lumenalta,lumenalta.com,"Clevertech Partners, LLC.",lumenalta.com,Yes,Child and parent share the same domain (heuristic),Heuristic,2026-03-13 12:00
Lunar,lunar.app,Lunar Group A/S,lunar.app,Yes,Child and parent share the same domain (heuristic),Heuristic,2025-03-18 12:07
Lunit Cancer Screening,lunit.io,Lunit Inc.,lunit.io,Yes,Child and parent share the same domain (heuristic),Heuristic,2026-05-15 15:36
Luno,luno.com,Digital Currency Group (DCG),dcg.co,Yes,"Luno was acquired by Digital Currency Group (DCG) in 2020, making DCG its majority owner.",LLM+web search,2026-06-19 04:15
Lusha,lusha.com,"PSG (Providence Strategic Growth) Equity Partners, L.P.",psgequity.com,Yes,Lusha confirmed as PSG portfolio company; one of PSG's 4 unicorns with $1B+ valuation.,LLM+web search (optimized),2026-05-15 15:36
LuxAlgo,luxalgo.com,"LuxAlgo Global, LLC",luxalgo.com,Yes,"LuxAlgo Global, LLC is the legal entity that does business as LuxAlgo, operating the same luxalgo.com domain — same company, not a separate acquirer.",LLM+web search,2026-05-15 16:09
LUX MED,luxmed.pl,Bupa Group,bupa.com,Yes,Bupa Group completed acquisition of LUX MED (Poland's largest private healthcare provider) in January 2013 for €400 million; continues ownership.,LLM+web search (optimized),2026-05-15 15:27
Luxury Escapes,luxuryescapes.com,Lux Group Limited.,luxuryescapes.com,Yes,Child and parent share the same domain (heuristic),Heuristic,2025-10-28 19:17
M1,m1.com,"M1 Holdings, Inc.",m1.com,Yes,Child and parent share the same domain (heuristic),Heuristic,2026-05-15 15:43
M3,m3as.com,Blackstone,blackstone.com,Yes,"M3 website press release references CEO appointment following Blackstone acquisition, confirming Blackstone ownership.",LLM+web search (optimized),2026-05-15 15:37
Maaden,maaden.com,Public Investment Fund of Saudi Arabia (PIF),pif.gov.sa,Yes,Maaden (Saudi Arabian Mining Company) is majority-owned by PIF with approximately 63-67% ownership stake.,LLM+web search (optimized),2026-04-09 20:36
"Pride Estates, Inc.",maccosmetics.com,Estée Lauder Companies Inc.,elcompanies.com,Yes,"Pride Estates, Inc. owns maccosmetics.com domain; MAC Cosmetics acquired by Estée Lauder in 1998.",LLM+web search (optimized),2025-09-26 04:30
Mace,macegroup.com,"Goldman Sachs Group, Inc.",goldmansachs.com,Yes,Goldman Sachs Alternatives acquired 75% majority stake in Mace Consult in 2025 transaction.,LLM+web search (optimized),2025-08-13 09:53
AIM Research,machinehack.com,Analytics India Magazine Private Limited,analyticsindiamag.com,Yes,"AIM Research, MachineHack, and Analytics India Magazine are all founded and owned by Bhasker Gupta under the same AIM media/research company (aim.media brand portfolio).",LLM+web search,2026-05-15 16:14
Mack Technologies,macktech.com,Mack Group Corporation,macktech.com,Yes,Child and parent share the same domain (heuristic),Heuristic,2025-12-16 13:17
Macquarie Group,macquarie.com,Macquarie Group Limited,macquarie.com,Yes,Child and parent share the same domain (heuristic),Heuristic,2025-08-19 12:32
Mac Tools,mactools.com,"Stanley Black & Decker, Inc.",stanleyblackanddecker.com,Yes,Mac Tools is part of Stanley Black & Decker's corporate umbrella; wholly-owned subsidiary.,LLM+web search (optimized),2025-09-18 15:56
Made4net,made4net.com,"Ingka Group, LLC.",ingka.com,Yes,"Ingka Group (via Ingka Investments) acquired 100% of Made4net in 2023, confirmed by press releases from Made4net, Ingka, and IKEA.",LLM+web search,2026-07-09 09:05
Madewell,madewell.com,"J.Crew Group, LLC",jcrew.com,Yes,"J.Crew Group acquired Madewell on December 31, 2006; Madewell operates as brand under J.Crew Group.",LLM+web search (optimized),2026-01-23 10:12
Ma Earth,maearth.com,Ma Earth Foundation,maearth.com,Yes,"Ma Earth Foundation (a Swiss tax-exempt foundation) wholly owns Ma Earth Labs AG, which operates the maearth.com platform.",LLM+web search,2026-06-26 08:09
Maesa,maesa.com,"Bain Capital Private Equity, LLC.",baincapital.com,Yes,Bain Capital Private Equity acquired majority stake in Maesa (beauty incubator) in 2019.,LLM+web search (optimized),2025-07-22 18:51
Magicline,magicline.com,Sport Alliance GmbH,sportalliance.com,Yes,Magicline is Sport Alliance's flagship membership management ERP product; wholly owned and operated by Sport Alliance.,LLM+web search (optimized),2026-04-09 20:34
Magicmotorsport,magicmotorsport.com,Magic Engineering S.r.l.,magicmotorsport.com,Yes,Child and parent share the same domain (heuristic),Heuristic,2026-05-15 15:44
Magma Math,magmamath.com,Radish Education Inc.,magmamath.com,Yes,Child and parent share the same domain (heuristic),Heuristic,2026-05-15 15:42
MagMutual,magmutual.com,MAG Mutual Holding Company,magmutual.com,Yes,Child and parent share the same domain (heuristic),Heuristic,2026-05-15 15:33
Mahindra Group,mahindra.com,Mahindra Group,mahindra.com,Yes,Child and parent share the same domain (heuristic),Heuristic,2026-05-15 15:22
The Mahoney Group,mahoneygroup.com,M&O Agencies LLC.,mahoneygroup.com,Yes,Child and parent share the same domain (heuristic),Heuristic,2026-01-22 09:35
Maieuticapp,maieuticapp.com,"FT LABS, SAS.",maieuticapp.com,Yes,Child and parent share the same domain (heuristic),Heuristic,2026-03-18 13:10
Intuit Mailchimp,mailchimp.com,Intuit Inc.,intuit.com,Yes,"Intuit acquired Mailchimp for $12 billion with deal completed November 1, 2021.",LLM+web search (optimized),2025-09-17 14:43
Mainline Menswear,mainlinemenswear.co.uk,JD Sports Fashion plc,jdplc.com,Yes,JD Sports acquired majority stake in Mainline Menswear approximately 10 years ago and currently owns it as subsidiary.,LLM+web search (optimized),2025-12-03 08:10
Mainsail Partners,mainsailpartners.com,"Mainsail Management Company, LLC",mainsailpartners.com,Yes,Child and parent share the same domain (heuristic),Heuristic,2026-05-15 15:38
Maintel,maintel.co.uk,Maintel Holdings Plc,maintel.co.uk,Yes,Child and parent share the same domain (heuristic),Heuristic,2026-05-15 15:35
Maintouch,maintouch.com,"Maintouch Labs, Inc.",maintouch.com,Yes,Child and parent share the same domain (heuristic),Heuristic,2026-04-09 20:37
Maison du Software,maisondu.software,Techgroup Schweiz AG,maisondu.software,Yes,"Maison du Software is a brand/trading name founded and operated by Techgroup Schweiz AG, i.e. the same legal entity.",LLM+web search,2026-05-15 16:01
Majid Al Futtaim,majidalfuttaim.com,Majid Al Futtaim Group.,majidalfuttaim.com,Yes,Child and parent share the same domain (heuristic),Heuristic,2026-05-15 15:23
Make,make.com,"Celonis, Inc.",celonis.com,Yes,"Celonis acquired Integromat in 2020 (later rebranded to Make), making it a wholly-owned Celonis business unit.",LLM+web search,2026-06-15 09:06
"Makena Capital Management, LLC",makenacap.com,"Makena Capital Holdings, L.P.",makenacap.com,Yes,Child and parent share the same domain (heuristic),Heuristic,2026-02-22 13:00
MakoLab,makolab.com,MakoLab S.A.,makolab.com,Yes,Child and parent share the same domain (heuristic),Heuristic,2026-05-15 15:38
Maktouch,maktouch.com,Splitmedialabs Ltd.,splitmedialabs.com,Yes,SplitmediaLabs acquired Maktouch; confirmed by search results showing Maktouch as part of SplitmediaLabs portfolio.,LLM+web search (optimized),2026-03-01 08:33
(株)マクアケ,makuake.co.jp,"CyberAgent, Inc.",cyberagent.co.jp,Yes,"CyberAgent held 51.60% of Makuake's voting rights as of September 2022, making it the majority parent company.",LLM+web search,2026-05-15 16:11
Maltego,maltego.com,"Charlesbank Capital Partners, LLC.",charlesbank.com,Yes,"Charlesbank Technology Opportunities Fund made a $100M Series C investment in Maltego in May 2023, confirming majority ownership stake.",LLM+web search (optimized),2026-05-15 15:41
ManageXR,managexr.com,"Mighty Immersion, Inc.",managexr.com,Yes,Child and parent share the same domain (heuristic),Heuristic,2025-07-11 14:59
MANN+HUMMEL,mann-hummel.com,MANN+HUMMEL International GmbH & Co. KG,mann-hummel.com,Yes,Child and parent share the same domain (heuristic),Heuristic,2026-05-15 15:24
,mannaz.cc,IDA (Ingeniørforeningen i Danmark) - Mannaz A/S is owned by IDA.,ida.dk,Yes,CSV data explicitly states 'Mannaz A/S is owned by IDA'; Wikipedia confirms Mannaz is part of IDA Group.,LLM+web search (optimized),2026-02-02 15:15
Manpower,manpower.com,ManpowerGroup Inc.,manpowergroup.com,Yes,Manpower is a primary contingent staffing brand of ManpowerGroup Inc.,LLM+web search (optimized),2025-09-18 09:10
MANTL,mantl.com,"Alkami Technology, Inc.",alkami.com,Yes,MANTL's website explicitly states 'Alkami completes its acquisition of MANTL.',LLM+web search (optimized),2025-09-27 16:41
MANUAL,manual.co,Menwell Limited,manual.co,Yes,"UK company filings and Manual's own terms/site confirm Menwell Limited owns and operates manual.co, trading as 'Manual'.",LLM+web search,2026-06-02 11:04
MAPFRE Insurance Company Inc.,mapfreinsurance.com,MAPFRE S.A.,mapfre.com,Yes,"MAPFRE Insurance Company is a subsidiary of MAPFRE S.A., the Spanish parent holding company.",LLM+web search,2026-05-15 15:51
NEXON,maplestory.io,Nexon America Inc.,nexon.com,Yes,"MapleStory is published and owned by Nexon Co., Ltd.; Nexon America Inc. is the US subsidiary of Nexon.",LLM+web search (optimized),2026-03-23 09:29
MARA,mara.com,"MARA Holdings, Inc.",mara.com,Yes,Child and parent share the same domain (heuristic),Heuristic,2026-05-15 15:37
Marathon Petroleum Corporation,marathonpetroleum.com,Marathon Petroleum Corporation (MPC),marathonpetroleum.com,Yes,Child and parent share the same domain (heuristic),Heuristic,2025-12-16 13:42
MARCHON,marchon.co.uk,VSP Vision Corporation,vsp.com,Yes,"VSP Vision acquired Marchon Eyewear in 2008 for $735 million, and multiple sources (WWD, Review of Optometry, Moodie Davitt) still refer to VSP Vision as 'Marchon owner'.",LLM+web search,2026-05-15 16:00
Marco Technologies,marconet.com,Norwest Equity Partners (NEP),nep.com,Yes,Norwest Equity Partners publicly announced its acquisition of Marco (Marco Technologies) in 2015 and lists it as a current portfolio company on nep.com.,LLM+web search,2026-06-23 09:46
marcus.me,marcus.me,Goldman Sachs Bank USA,goldmansachs.com,Yes,"Marcus is Goldman Sachs' digital banking brand, fully owned subsidiary of Goldman Sachs Bank USA.",LLM+web search (optimized),2025-06-04 18:16
Marfrig Global Foods,marfrig.com.br,Marfrig Global Foods S.A.,marfrig.com.br,Yes,Child and parent share the same domain (heuristic),Heuristic,2026-05-15 15:25
Marimo,marimo.io,"CoreWeave, Inc.",coreweave.com,Yes,"CoreWeave announced definitive agreement to acquire Marimo on October 30, 2025, making it a subsidiary.",LLM+web search (optimized),2025-09-19 10:02
Mariner Investment Group,marinercapital.com,LPL Financial Holdings Inc.,lpl.com,Yes,LPL Financial leads acquisition of Mariner Advisor Network with 367 financial advisors managing $31B in assets (2026).,LLM+web search (optimized),2026-02-02 17:05
Markel,markel.com,Markel Group Inc.,mklgroup.com,Yes,"Markel Corporation officially renamed itself Markel Group Inc. in 2023 and launched mklgroup.com as its site—same company/ticker (MKL), not a separate acquirer.",LLM+web search,2026-07-10 17:25
Marks & Spencer,marksandspencer.com,Marks and Spencer Group P.L.C.,marksandspencer.com,Yes,Child and parent share the same domain (heuristic),Heuristic,2025-02-05 02:38
M&S Corporate Gifts,marksandspencerforbusiness.com,Marks and Spencer Group p.l.c.,marksandspencer.com,Yes,"M&S Corporate Gifts (marksandspencerforbusiness.com) is Marks and Spencer plc's corporate gifting business unit, issued and operated by M&S itself.",LLM+web search,2026-05-15 16:18
Marmon Foodservice Technologies,marmonfoodservice.com,Berkshire Hathaway.,berkshirehathaway.com,Yes,"Wikipedia confirms Marmon Group is owned by Berkshire Hathaway (controlling stake 2007, sole owner 2013), and Marmon Foodservice Technologies is Marmon Group subsidiary.",LLM+web search (optimized),2025-09-18 19:16
Marsolab,marsolab.com,Marsoft Research Lab SL.,marsolab.com,Yes,"Child domain marsolab.com and parent domain marsolab.com are identical, indicating Marsoft Research Lab SL is the legal entity for the same Marsolab company.",LLM+web search,2026-06-26 08:06
Marsus,marsus.com,Marsus Digital Limited,marsus.com,Yes,Child and parent share the same domain (heuristic),Heuristic,2025-09-22 15:34
Mars Venus Coaching,marsvenuscoaching.com,"Mars Venus Coaching Global, Inc.",marsvenuscoaching.com,Yes,Child and parent share the same domain (heuristic),Heuristic,2026-04-09 20:39
Mars Veterinary Health,marsveterinary.com,"Mars, Incorporated",mars.com,Yes,Mars Veterinary Health is a division of Mars Petcare (Mars Inc.).,LLM+web search (optimized),2026-05-15 15:23
Masco Corporation,mascocareers.com,Masco Corporation,masco.com,Yes,Child and parent names match after stripping legal suffix (heuristic),Heuristic,2026-05-15 15:31
Mash,mash.com,Bain Capital Private Equity Ltd.,baincapital.com,Yes,Bain Capital acquired 100% of Mash Holdings for $1.44 billion in November 2022.,LLM+web search (optimized),2025-08-25 16:25
Masimo,masimo.com,Danaher Corporation.,danaher.com,Yes,Danaher agreed to acquire Masimo in February 2026 for approximately $10 billion.,LLM+web search (optimized),2025-08-13 14:00
Salem Hospital,massgeneralbrigham.org,Mass General Brigham Inc.,massgeneralbrigham.org,Yes,Child and parent share the same domain (heuristic),Heuristic,2025-07-08 15:07
SEFNCO Communications,mastecnetworksolutions.com,"MasTec, Inc.",mastec.com,Yes,Domain mastecnetworksolutions.com indicates SEFNCO Communications is a MasTec subsidiary.,LLM+web search (optimized),2025-07-23 12:25
Mastercard Foundation,mastercardfdn.org,Mastercard Inc.,mastercard.com,Yes,Mastercard Foundation is controlled by Mastercard Inc. through governance and majority control structure.,LLM+web search (optimized),2025-12-18 03:06
MasterClass,masterclass.com,"Yanka Industries, Inc.",masterclass.com,Yes,Child and parent share the same domain (heuristic),Heuristic,2026-05-15 15:35
Masterworks,masterworks.com,Masterworks Advisers LLC.,masterworks.com,Yes,Child and parent share the same domain (heuristic),Heuristic,2026-05-15 15:39
Mathnasium - The Math Learning Center,mathnasium.com,Roark Capital Group,roarkcapital.com,Yes,Mathnasium is documented as a portfolio company of Roark Capital Group.,LLM+web search (optimized),2026-02-15 15:42
Maths Circle,mathscircle.com,Maths Circle Ltd.,mathscircle.com,Yes,"Maths Circle Ltd is the registered UK legal entity operating mathscircle.com (Companies House #09861676), i.e. the same company under its legal name.",LLM+web search,2026-05-20 04:09
Johnson Matthey,matthey.com,Johnson Matthey Plc,matthey.com,Yes,Child and parent share the same domain (heuristic),Heuristic,2026-05-15 15:24
Maveris,maveris.com,"Harmonia Holdings Group, LLC.",harmonia.com,Yes,Harmonia Holdings Group acquired Maveris in January 2025 as a wholly-owned subsidiary.,LLM+web search (optimized),2026-05-15 15:42
Mavis Tire,mavis.com,Mavis Tire Express Services Corp.,mavis.com,Yes,Child and parent share the same domain (heuristic),Heuristic,2026-05-15 15:26
Max Kelsen,maxkelsen.com,Bain & Company,bain.com,Yes,"Bain & Company announced on July 31, 2023 that it acquired Max Kelsen's consulting and managed services divisions.",LLM+web search,2026-05-15 16:15
Max Rice,maxrice.com,GoDaddy Inc.,godaddy.com,Yes,"Max Rice is cofounder of SkyVerge, which GoDaddy acquired in 2020.",LLM+web search (optimized),2026-04-03 20:49
Mayo Clinic School of Health Sciences,mayo.edu,Mayo Foundation for Medical Education and Research,mayo.edu,Yes,Child and parent share the same domain (heuristic),Heuristic,2025-07-08 15:51
Mayo Clinic,mayoclinic.org,Mayo Foundation for Medical Education and Research (MFMER),mayoclinic.org,Yes,Child and parent share the same domain (heuristic),Heuristic,2025-10-12 19:19
Mayo Clinic Health System In Eau Claire,mayoclinichealthsystem.org,Mayo Clinic,mayoclinic.org,Yes,Mayo Clinic partially owns and operates MCHS per Wikipedia.,LLM+web search (optimized),2025-10-12 23:27
