child_name,child_domain,parent_name,parent_domain,verified,evidence,verification_method,date_added
eClerx,eclerx.com,eClerx Services Limited,eclerx.com,Yes,Child and parent share the same domain (heuristic),Heuristic,2026-05-15 15:23
EDEKA FRUCHTKONTOR ESPAÑA SOCIEDAD LIMITADA,edeka.de,Edeka Zentrale AG & Co. KG,edeka.de,Yes,Child and parent share the same domain (heuristic),Heuristic,2026-05-15 15:25
Edge Network,edge.network,"Phenom Holdings, Inc.",phenom.com,Yes,Phenom Holdings acquired EDGE (talent mobility platform) in February 2025.,LLM+web search (optimized),2026-04-09 18:09
EDGE Empower,edgeempower.com,EDGE Strategy AG,edgeempower.com,Yes,"EDGE Strategy AG (Zug, Switzerland) is the company that created and operates the EDGE Empower DE&I SaaS platform, sharing the same domain edgeempower.com.",LLM+web search,2026-05-15 16:04
Edgemont Partners,edgemont.com,"Edgemont Capital Partners, L.P.",edgemont.com,Yes,"Edgemont Capital Partners, L.P. rebranded to Edgemont Partners — same firm, same domain (edgemont.com), confirmed via multiple sources including a Becker's ASC rebrand article.",LLM+web search,2026-06-17 17:11
EDGE,edgescore.com,NinjaHoldings Inc.,ninjaholdings.com,Yes,NinjaHoldings' own website lists Edge/edgescore.com as one of its owned brands (Ninja Holdings > Edge).,LLM+web search,2026-05-15 16:00
Edify Software Consulting,edify.cr,Avaya Holdings Corp.,avaya.com,Yes,Avaya Holdings acquired Edify in May 2024; Edify's orchestration capabilities integrated into Avaya Experience Platform as subsidiary.,LLM+web search,2026-05-15 15:47
Edison International,edison.com,"Edison International, Inc.",edison.com,Yes,Child and parent share the same domain (heuristic),Heuristic,2025-09-16 07:26
EducacionIT,educacionit.com,ISTEA (part of the educational group EducaciónIT),educacionit.com,Yes,Child and parent share the same domain (heuristic),Heuristic,2026-05-15 15:33
Education Perfect,educationperfect.com,KKR & Co Inc.,kkr.com,Yes,KKR acquired majority stake in Education Perfect from Mulpha International in 2021; deal valued at $319M.,LLM+web search (optimized),2026-05-15 15:36
Edward Jones,edwardjones.com,"The Jones Financial Companies, L.L.L.P.",edwardjones.com,Yes,Child and parent share the same domain (heuristic),Heuristic,2025-09-23 16:47
Effectful,effectful.co,"Effectful Technologies, Inc.",effectful.co,Yes,Child and parent share the same domain (heuristic),Heuristic,2026-02-02 15:55
the wrigley company limited,effem.com,"Mars, Incorporated",mars.com,Yes,Wrigley Company is a subsidiary of Mars Inc. following $23 billion acquisition in 2008.,LLM+web search (optimized),2025-07-14 16:35
EF Educational Tours,eftours.com,EF Education First (EF),ef.edu,Yes,Wikipedia confirms EF Educational Tours is travel program launched and operated by EF Education First.,LLM+web search (optimized),2026-05-15 15:31
Sheldon Genack Md,ehs.org,St. John’s Episcopal Hospital.,ehs.org,Yes,Child and parent share the same domain (heuristic),Heuristic,2025-09-19 10:42
Dissin Properties,eia.gov,U.S. Department of Energy,energy.gov,Yes,"eia.gov (U.S. Energy Information Administration) is a statistical agency operating within the U.S. Department of Energy (energy.gov), though the listed company name 'Dissin Properties' does not match EIA's actual identity.",LLM+web search,2026-07-06 11:18
Ekos Solutions,ekossolutions.com,"Next Glass, Inc.",nextglass.co,Yes,"Next Glass publicly announced its acquisition of Ekos (craft beverage supply chain software) in October 2025 (PR Newswire, nextglass.co).",LLM+web search,2026-05-15 16:14
eks Energy,eksenergy.com,Hitachi Group Company,hitachi.com,Yes,Hitachi Energy acquired remaining stake in eks Energy in August 2025; now wholly-owned subsidiary.,LLM+web search,2026-05-15 15:51
Elastic,elastic.co,Elastic NV,elastic.co,Yes,Child and parent share the same domain (heuristic),Heuristic,2025-07-23 11:04
El Corte Inglés,elcorteingles.es,Grupo El Corte Inglés,elcorteingles.es,Yes,Child and parent share the same domain (heuristic),Heuristic,2026-05-15 15:23
El Deba,eldabatrading.com,El Daba Holdings,eldabatrading.com,Yes,Child and parent share the same domain (heuristic),Heuristic,2026-02-26 02:23
Elder Research,elderresearch.com,MANTECH,mantech.com,Yes,Elder Research's website confirms MANTECH ownership via acquisition.,LLM+web search (optimized),2025-09-24 14:50
The Electric Car Scheme,electriccarscheme.com,The Electric Car Scheme Holdings Limited,electriccarscheme.com,Yes,Child and parent share the same domain (heuristic),Heuristic,2026-03-18 07:24
Elektra,elektra.com.mx,Grupo Salinas.,gruposalinas.com,Yes,Elektra is owned by Grupo Salinas through Grupo Elektra's acquisition and consolidation of Salinas y Rocha.,LLM+web search (optimized),2025-07-12 17:28
Eletive,eletive.com,Accel-KKR,accel-kkr.com,Yes,Accel-KKR acquired majority stake in Eletive in November 2025; confirmed private equity acquisition.,LLM+web search,2026-05-15 15:47
Elsevier,elsevier.com,RELX,relx.com,Yes,Wikipedia confirms Elsevier is a subsidiary of RELX Group; formerly known as Reed Elsevier; accounted for 34% of RELX revenues as of 2019.,LLM+web search (optimized),2025-12-11 21:18
national geographic learning elt,eltngl.com,"Cengage Learning, Inc.",cengage.com,Yes,National Geographic Learning is confirmed as a Cengage subsidiary; acquired by Cengage in 2011 (Wikipedia).,LLM+web search (optimized),2025-07-26 02:03
,email.cz,"Seznam.cz, a.s.",seznam.cz,Yes,"email.cz redirects to email.seznam.cz, indicating ownership by Seznam.cz.",LLM+web search (optimized),2026-04-08 04:22
Emailable,emailable.com,"Cache Ventures, LLC.",cacheventures.com,Yes,"Multiple sources confirm Emailable (emailable.com) was formed from Cache Ventures' acquisitions of Blaze Verify and TheChecker, and is owned by Cache Ventures.",LLM+web search,2026-06-08 13:13
Emarsys,emarsys.com,SAP SE,sap.com,Yes,SAP is parent company of Emarsys; now rebranded as SAP Engagement Cloud in SAP Customer Experience portfolio.,LLM+web search (optimized),2026-04-09 20:44
Embassy Suites,embassysuites.com,Hilton Worldwide Holdings Inc.,hilton.com,Yes,"Embassy Suites is a subsidiary of Hilton Worldwide Holdings Inc., acquired through the 1999 Hilton-Promus merger.",LLM+web search (optimized),2026-02-23 14:37
Embedly,embed.ly,Medium Inc.,medium.com,Yes,"Medium acquired Embedly (embed.ly) in August 2016 per multiple contemporaneous press reports (TechCrunch, VentureBeat, Crunchbase).",LLM+web search,2026-05-15 16:15
Ember,ember.to,"Silicon Labs, Inc.",silabs.com,Yes,"Silicon Labs completed acquisition of Ember Corporation on July 9, 2012 for $72 million; Ember became a wholly-owned subsidiary.",LLM+web search,2026-05-15 15:52
EMCS,emcs.co.uk,East Midlands Central Station Limited,emcs.co.uk,Yes,"Child and parent share the identical name/domain (EMCS / East Midlands Central Station Limited, emcs.co.uk), indicating the same legal entity.",LLM+web search,2026-05-28 08:13
"Merck KGaA, Darmstadt, Germany",emdgroup.com,"Merck KGaA, Darmstadt, Germany",merckgroup.com,Yes,"emdgroup.com and merckgroup.com are both official sites of the same company, Merck KGaA, Darmstadt, Germany—emdgroup.com is simply its North American brand/domain, not a separate parent.",LLM+web search,2026-07-10 15:24
Kellen Busby Software,emdmillipore.com,"Merck KGaA, Darmstadt, Germany",merckgroup.com,Yes,"emdmillipore.com belongs to EMD Millipore, the life-science division formed after Merck KGaA's 2010 acquisition of Millipore Corporation, making it a subsidiary of Merck KGaA.",LLM+web search,2026-07-01 17:10
Emergent Holdings,emergentholdingsinc.com,AFGroup AWS,emergentholdingsinc.com,Yes,Child and parent share the same domain (heuristic),Heuristic,2026-02-25 09:05
Emerge Tools,emergetools.com,"Sentry, Inc.",sentry.io,Yes,"Sentry announced its acquisition of Emerge Tools on May 6, 2025, making it part of Sentry.",LLM+web search,2026-05-15 16:17
Emergo Technology,emergotec.com,Underwriters Laboratories (UL),ul.com,Yes,"Underwriters Laboratories (UL) acquired Emergo Group, a medical-device regulatory consulting firm, in 2017, and this India-based 'Emergo Technology' entity (emergotec.com) aligns with Emergo Group's known global offices and business line.",LLM+web search,2026-05-15 16:15
EMI Health,emihealth.com,"Educators Mutual Insurance Association and Educators Health Plans Life, Accident and Health.",emihealth.com,Yes,Child and parent share the same domain (heuristic),Heuristic,2026-05-15 15:44
株式会社エモーションテック,emotion-tech.co.jp,Plaid Inc.,plaid.com,Yes,"PLAID, Inc. (Japan) announced on Aug 27, 2021 that it acquired 64% of Emotion Tech's shares, making it a group/majority-owned subsidiary (note: parent domain in the row, plaid.com, appears to be a data mismatch for the correct Japanese parent domain plaid.co.jp, but the company name and ownership stake are confirmed).",LLM+web search,2026-05-15 16:04
Empire Company Limited,empireco.ca,Empire Company Limited,empireco.ca,Yes,Child and parent share the same domain (heuristic),Heuristic,2026-05-15 15:25
Employers AI,employers.ai,Employers AI Limited,employers.ai,Yes,Employers AI Limited (same domain employers.ai) is the registered legal entity operating the Employers AI hiring platform.,LLM+web search,2026-05-15 16:13
Empower Pharmacy,empowerpharmacy.com,"Empower Clinic Services, LLC.",empowerpharmacy.com,Yes,Child and parent share the same domain (heuristic),Heuristic,2026-05-06 01:44
Emtech,emtechgroup.com,Alten Group S.A.,alten.com,Yes,Multiple sources state Emtech Group (emtechgroup.com) was acquired by the Alten Group in 2023.,LLM+web search,2026-05-15 15:59
EMURGO,emurgo.io,EMURGO Ptd. Ltd.,emurgo.io,Yes,Child and parent share the same domain (heuristic),Heuristic,2026-03-04 07:05
Encord,encord.com,"Cord Technologies, Inc.",encord.com,Yes,Child and parent share the same domain (heuristic),Heuristic,2025-03-07 06:24
Encore,encoreglobal.com,Encore Global LP (Blackstone Inc.),encoreglobal.com,Yes,Child and parent share the same domain (heuristic),Heuristic,2026-05-15 15:24
Encore Musicians,encoremusicians.com,Mixcloud Ltd.,mixcloud.com,Yes,Mixcloud acquired Encore Musicians in September 2024; Encore continues operating as independent brand but is wholly owned subsidiary.,LLM+web search (optimized),2026-03-13 12:02
Encore Theme Technologies (ETT),encoretheme.com,Wipro Ltd.,wipro.com,Yes,Wipro announced a definitive agreement in Oct 2020 to acquire Encore Theme Technologies and completed full acquisition (83.4% then up to 96.7% then 100%) by Dec 2022.,LLM+web search,2026-05-15 16:16
Endava,endava.com,Endava plc.,endava.com,Yes,Child and parent share the same domain (heuristic),Heuristic,2026-05-14 12:02
Endear,endearhq.com,"We Are Arthur, Inc.",endearhq.com,Yes,"Endear's own Terms of Service and legal pages confirm 'We Are Arthur, Inc.' is simply the registered legal name under which the Endear (endearhq.com) business operates — same entity.",LLM+web search,2026-05-15 16:00
Endiya Partners,endiya.com,Endiya Partners,endiya.com,Yes,Child and parent share the same domain (heuristic),Heuristic,2026-05-15 15:30
Groupe EndLess,endless.fr,Groupe Endless,endless.fr,Yes,Child and parent share the same domain (heuristic),Heuristic,2026-03-20 13:18
Endress+Hauser,endress.com,Endress+Hauser Group Services AG,endress.com,Yes,Child and parent share the same domain (heuristic),Heuristic,2026-03-01 08:33
Engineering Brasil,engdb.com.br,Grupo Engineering,engdb.com.br,Yes,Child and parent share the same domain (heuristic),Heuristic,2026-05-15 15:30
Engine B,engineb.com,CliftonLarsonAllen LLP,claconnect.com,Yes,"CLA (CliftonLarsonAllen LLP) acquired UK-based Engine B, finalized May 1, 2024, per PRNewswire, CPA Practice Advisor, and Accounting Today coverage of the acquisition.",LLM+web search,2026-05-15 16:09
EngineRoom,engineroom.com.au,CXAI Australia,cxapp.com,Yes,"CXApp (CXAI) acquired 100% of EngineRoom for ~$4.6M via its subsidiary CXAI Australia, closed June 3, 2026.",LLM+web search,2026-05-15 16:01
Enigen,enigen.co.uk,Lutech S.p.A.,lutech.group,Yes,"Lutech Group's own newsroom confirms Enigen joined the Lutech Group (acquired 2019), later merged to form TenEnigen.",LLM+web search,2026-05-15 15:59
Enigmatic Smile Limited,enigmaticsmile.com,Capture Value Ltd.,enigmaticsmile.com,Yes,"Capture Value Ltd owns 86.8% of Enigmatic Smile Limited, constituting clear majority control per UK Companies House filings.",LLM+web search,2026-05-15 15:51
Enpro Inc.,enpro.com,"EnPro Holdings, Inc.",enpro.com,Yes,Child and parent share the same domain (heuristic),Heuristic,2026-03-13 11:59
Enquizit (A CDW Company),enquizit.com,CDW Corporation,cdw.com,Yes,"Enquizit website explicitly states 'Enquizit is a CDW Company,' confirming CDW ownership.",LLM+web search (optimized),2025-09-18 22:21
Entegris,entegris.com,"Entegris, Inc.",entegris.com,Yes,Child and parent share the same domain (heuristic),Heuristic,2026-04-09 20:46
Entendre,entendre.finance,MoonPay,moonpay.com,Yes,"MoonPay announced (June 2026) it acquired Entendre, the AI accounting-agent startup, per PR Newswire and multiple fintech news outlets.",LLM+web search,2026-05-19 14:12
Enterprise,enterprise.com,"Enterprise Holdings, Inc.",enterprise.com,Yes,Child and parent share the same domain (heuristic),Heuristic,2026-05-15 15:23
Enthusiast Gaming,enthusiastgaming.com,Enthusiast Gaming Holdings Inc.,enthusiastgaming.com,Yes,Child and parent share the same domain (heuristic),Heuristic,2026-03-25 11:26
entrypoint,entrypoint.co.il,"Entrypoint Systems 2004, Ltd.",entrypoint.co.il,Yes,Same company sharing identical domain (entrypoint.co.il); appears to be the same legal entity under different naming conventions.,LLM+web search,2026-05-15 15:53
Entur AS,entur.no,Norwegian Ministry of Transport and Communications,regjeringen.no,Yes,Entur AS is government-owned company controlled by Norwegian Ministry of Transport.,LLM+web search (optimized),2026-05-15 15:36
Envestnet,envestnet.com,Bain Capital LLC,baincapital.com,Yes,"Bain Capital completed its $4.5B take-private acquisition of Envestnet on Nov 25, 2024, taking Envestnet private under Bain Capital's ownership.",LLM+web search,2026-06-21 21:24
Enviera,enviera.com,PT Envisi Era Teknologi,enviera.com,Yes,Child and parent share the same domain (heuristic),Heuristic,2026-04-14 04:59
eos.uptrade,eos-uptrade.de,Siemens Mobility.,mobility.siemens.com,Yes,Siemens Mobility is a confirmed subsidiary of Siemens AG.,LLM+web search (optimized),2026-05-15 15:48
EOS Digital,eos.cz,Otto Group.,ottogroup.com,Yes,"EOS Group, which operates receivables management/debt collection across Europe including Czech operations (eos.cz/EOS KSI), is explicitly listed by Otto Group as a group company/subsidiary.",LLM+web search,2026-07-08 09:58
"Energetický a průmyslový holding, a.s.",epholding.cz,"Energetický a průmyslový holding, a.s. (EPH)",epholding.cz,Yes,Child and parent share the same domain (heuristic),Heuristic,2026-05-15 15:31
EPITA,epita.fr,IONIS Education Group,ionis-group.com,Yes,EPITA (founded 1984) is a computer engineering school that is part of IONIS Education Group's portfolio.,LLM+web search (optimized),2026-02-18 09:38
Epitech Digital School,epitech.digital,IONIS Education Group,ionis-group.com,Yes,Epitech was created in 1999 and is part of IONIS Education Group with multiple campuses across France.,LLM+web search (optimized),2026-03-01 08:33
EPITECH - European Institute of Technology,epitech.eu,IONIS Education Group.,ionis-group.com,Yes,Epitech operates with headquarters in Le Kremlin-Bicêtre and multiple campuses; part of IONIS Education Group.,LLM+web search (optimized),2025-07-25 10:05
Enviropower Renewable Inc.,eprenewable.com,"EnviroPower Renewable, Inc.",eprenewable.com,Yes,Child and parent share the same domain (heuristic),Heuristic,2025-07-30 17:24
EPR FireWorks,eprfireworks.com,"EPR Systems, Inc.",eprfireworks.com,Yes,Child and parent share the same domain (heuristic),Heuristic,2026-03-18 07:03
"EPSILON, LLC",epsilonsec.ai,Publicis Groupe S.A.,publicisgroupe.com,Yes,Epsilon LLC was acquired by Publicis Groupe for $3.95 billion in July 2019; now subsidiary.,LLM+web search (optimized),2026-03-23 09:22
Equinor,equinor.com,Norwegian State (Government of Norway),regjeringen.no,Yes,Norwegian state owns 67% of Equinor; government is majority shareholder.,LLM+web search (optimized),2026-02-25 14:35
Equiti Group,equiti.com,Equiti Group Ltd.,equiti.com,Yes,Child and parent share the same domain (heuristic),Heuristic,2026-05-15 15:32
Equity Residential,equityapartments.com,"Equity Residential, Inc.",equityapartments.com,Yes,Child and parent share the same domain (heuristic),Heuristic,2025-09-19 16:19
Currently Unemployed,ernesthealth.com,One Equity Partners.,oneequity.com,Yes,Ernest Health acquired by One Equity Partners in May 2018 from Medical Properties Trust,LLM+web search (optimized),2026-02-03 10:51
Erste&Steiermärkische Bank d.d. (Erste Bank Croatia),erstebank.hr,Erste Group Bank AG,erstegroup.com,Yes,Erste Group Bank AG held 59% of the equity capital of Erste & Steiermärkische Bank (Erste Bank Croatia) as of end-2023.,LLM+web search,2026-07-11 09:05
Erste Group,erstegroup.com,ERSTE Foundation and Erste Group Bank AG hold controlling interest.,erstegroup.com,Yes,Child and parent share the same domain (heuristic),Heuristic,2026-05-15 15:23
e.sigma Systems GmbH,esigma-systems.com,Diehl Defence GmbH & Co. KG,new.diehl.com,Yes,"Diehl Defence GmbH & Co. KG completed a full takeover of e.sigma Systems GmbH (esigma-systems.com) in June 2025, confirmed by multiple press releases.",LLM+web search,2026-05-15 16:07
"Esis, Inc.",esis.com,Chubb Limited,chubb.com,Yes,"ESIS Inc. was part of ACE company which merged to become Chubb Limited, making it a Chubb subsidiary.",LLM+web search (optimized),2025-09-18 17:07
Essex Laboratories Inc,essexlabs.com,dsm-firmenich AG,dsm-firmenich.com,Yes,"Firmenich (now dsm-firmenich) acquired a majority equity stake in Essex Laboratories in 2016, forming an ongoing joint-venture/subsidiary partnership.",LLM+web search,2026-06-26 08:01
EssilorLuxottica,essilorluxottica.com,EssilorLuxottica S.A.,essilorluxottica.com,Yes,Child and parent share the same domain (heuristic),Heuristic,2026-05-15 15:23
The Estée Lauder Companies Inc.,estee.com,The Estée Lauder Companies Inc.,elcompanies.com,Yes,Child and parent names match after stripping legal suffix (heuristic),Heuristic,2025-08-05 22:04
Estuary Solutions,estuarysolutions.com,Estuary Solutions (Pty) Ltd.,estuarysolutions.com,Yes,Child and parent share the same domain (heuristic),Heuristic,2026-04-09 20:36
esurance.ch,esurance.ch,Allstate Corporation,allstate.com,Yes,Esurance is owned by Allstate Corporation (acquired 2011 for $1 billion); esurance.ch related to same company.,LLM+web search (optimized),2026-03-13 11:58
esynergy,esynergy.co.uk,Esynergy Holdings Limited,esynergy.co.uk,Yes,Child and parent share the same domain (heuristic),Heuristic,2026-05-15 15:45
"Ethan Allen Global, Inc.",ethanallen.com,Ethan Allen Interiors Inc.,ethanallen.com,Yes,Child and parent share the same domain (heuristic),Heuristic,2025-09-25 12:00
ETNA,etna-alternance.net,IONIS Education Group,ionis-group.com,Yes,ETNA is part of IONIS Education Group's portfolio of 29 schools across France and internationally.,LLM+web search (optimized),2026-03-26 12:01
Eucalyptus,eucalyptus.health,"Hims & Hers Health, Inc.",hims.com,Yes,Hims & Hers announced acquisition of Australian digital health company Eucalyptus in February 2026 for up to $1.15 billion.,LLM+web search (optimized),2026-05-15 15:32
Euclid Technology,euclidtechnology.com,Fullsteam Operations LLC.,fullsteam.com,Yes,"Euclid Technology was acquired by Fullsteam Operations on February 22, 2019.",LLM+web search (optimized),2025-09-24 15:30
eulenamerica,eulen.com,"EULEN, S.A.",eulen.com,Yes,Child and parent share the same domain (heuristic),Heuristic,2025-07-13 19:12
Eureka Labs,eurekalabs.io,Jobsity.,jobsity.com,Yes,Jobsity announced strategic acquisition of Eureka Labs in June 2026; acquisition completed for operational integration.,LLM+web search (optimized),2026-05-15 15:45
Eurofins Optimed Clinical Research,eurofinsoptimed.com,Eurofins Scientific S.E.,eurofins.com,Yes,Eurofins Optimed was acquired by Eurofins Scientific in 2006 and is presented on Eurofins' own corporate site as part of the Eurofins Biopharma Services network.,LLM+web search,2026-05-15 15:57
EV Connect,evconnect.com,Schneider Electric,se.com,Yes,"EV Connect was acquired by Schneider Electric in 2022, confirmed in Wikipedia.",LLM+web search (optimized),2026-02-24 19:44
Strengthen The Strong,eventbrite.com,Bending Spoons LLC.,bendingspoons.com,Yes,"Bending Spoons acquired Eventbrite for $500 million in December 2025, closed March 2026.",LLM+web search (optimized),2025-12-13 21:26
EventMobi,eventmobi.com,5Touch Solutions Inc.,eventmobi.com,Yes,Child and parent share the same domain (heuristic),Heuristic,2025-10-30 09:37
Eventpop,eventpop.me,"EVP Corporation Co., Ltd.",eventpop.me,Yes,Child and parent share the same domain (heuristic),Heuristic,2026-04-21 06:25
EventsAir,eventsair.com,Riverside Company Inc.,riversidecompany.com,Yes,"Riverside Company made a majority investment in EventsAir, Australian events management software provider.",LLM+web search (optimized),2026-05-15 15:43
EverCharge,evercharge.com,SK Group,sk.com,Yes,SK E&S (SK Group affiliate) acquired EverCharge in March 2022; EverCharge is now an SK E&S company.,LLM+web search,2026-05-15 15:50
Everfi,everfi.com,Blackbaud Inc.,blackbaud.com,Yes,Wikipedia confirms Blackbaud acquired EverFi in 2022 for $750 million as majority-stake acquisition.,LLM+web search (optimized),2026-01-26 22:46
Evergreen Wealth,evergreenmoney.com,"Wells Fargo & Company Holdings, Inc.",wellsfargo.com,Yes,Evergreen Investments became Wells Fargo subsidiary after Wachovia acquisition in 2009.,LLM+web search,2026-05-15 15:56
EverHealth,everhealth.com,EverCommerce Inc.,evercommerce.com,Yes,"EverHealth is a health-vertical brand/suite of EverCommerce, which owns constituent companies like DrChrono, Updox, and CollaborateMD under it.",LLM+web search,2026-06-26 15:55
Evernorth Health Services,evernorth.com,Cigna Corporation,cigna.com,Yes,Evernorth Health Services was formed in September 2020 as Cigna's rebranded health services portfolio.,LLM+web search (optimized),2025-10-07 14:47
Everpass Media,everpass.com,RedBird Capital Partners,redbirdcap.com,Yes,"RedBird Capital Partners website shows Everpass Media in its portfolio of companies across sports, media, entertainment, and financial services sectors.",LLM+web search (optimized),2026-02-10 17:59
EverWatch,everwatchsolutions.com,"Booz Allen Hamilton, Inc.",boozallen.com,Yes,Booz Allen Hamilton completed its $440M acquisition of EverWatch in October 2022; EverWatch became a wholly owned subsidiary.,LLM+web search,2026-05-15 16:04
EveryAction,everyaction.com,Bonterra,bonterratech.com,Yes,"everyaction.com redirects to bonterratech.com, confirming Bonterra ownership of EveryAction.",LLM+web search (optimized),2025-07-08 10:50
EvidentIQ,evidentiq.com,EvidentIQ Group GmbH.,evidentiq.com,Yes,Child and parent share the same domain (heuristic),Heuristic,2026-05-15 15:47
Workday Contract Management,evisort.com,"Workday, Inc.",workday.com,Yes,"Workday signed a definitive agreement and completed the acquisition of Evisort in 2024, rebranding it as Workday Contract Management.",LLM+web search,2026-05-15 15:56
synthetic intelligence works (evitar),evitar.ai,"Synthetic Intelligence Works, Inc.",evitar.ai,Yes,Child and parent share the same domain (heuristic),Heuristic,2025-07-16 12:50
EvolutionIQ,evolutioniq.com,"CCC Intelligent Solutions, Inc.",cccis.com,Yes,"EvolutionIQ website displays 'A CCC Company' logo, indicating CCC Intelligent Solutions owns it.",LLM+web search (optimized),2025-03-21 15:01
Evotec,evotec.com,Evotec SE,evotec.com,Yes,Child and parent share the same domain (heuristic),Heuristic,2026-04-09 18:33
Evri,evri.com,"Apollo Global Management, Inc.",apollo.com,Yes,"Apollo Global Management (via Apollo Funds) acquired Evri from Advent International in a ~£2.7bn deal in 2024, and Evri remains majority-owned by Apollo.",LLM+web search,2026-07-08 05:29
Evvy,evvy.com,Allora Health Inc.,evvy.com,Yes,Child and parent share the same domain (heuristic),Heuristic,2025-12-16 13:32
EWE AG,ewe.com,Weser-Ems-Energiebeteiligungen GmbH,ewe.com,Yes,Child and parent share the same domain (heuristic),Heuristic,2026-05-15 15:28
Exact Sciences,exactsciences.com,"Abbott Laboratories, Inc.",abbott.com,Yes,"Abbott Laboratories completed its ~$21B acquisition of Exact Sciences in March 2026, making it a direct wholly-owned subsidiary per Abbott's own press release.",LLM+web search,2026-05-17 12:02
ExamSpark,examspark.com,Campfire Learning (formerly ExamSpark) - None because no controlling entity was found.,campfirelearning.com,Yes,"ExamSpark domain redirects to Campfire Learning website, indicating acquisition/rebrand by Campfire Learning.",LLM+web search (optimized),2026-03-23 09:24
Exec,exec.com,"Exec Holdings, Inc.",exec.com,Yes,"Corporate filings and company profiles describe Exec Holdings, Inc. as the holding company for the Exec (exec.com) AI talent-development platform, i.e., its parent legal entity.",LLM+web search,2026-05-15 16:00
Exoticca,exoticca.com,"Pangealand, S.L.",exoticca.com,Yes,Child and parent share the same domain (heuristic),Heuristic,2026-05-15 15:34
Expedited Security,expeditedsecurity.com,Expedited SSL Inc.,expeditedsecurity.com,Yes,Child and parent share the same domain (heuristic),Heuristic,2025-08-03 07:43
experian,experianplc.com,Experian plc,experianplc.com,Yes,Child and parent share the same domain (heuristic),Heuristic,2025-07-09 13:25
